{"$comment":"{\"version\":\"financial-v3-dataset-v1\",\"kind\":\"financial_health_v3\",\"company_base\":{\"id\":\"string\",\"name\":\"string (source has no company name; id is displayed)\",\"group\":\"string\",\"currency\":\"string\",\"assessment_date\":\"ISO date\",\"model_version\":\"financial-v3-dataset-v1\",\"history_mode\":\"retrospective\",\"data_mode\":\"synthetic\",\"opening_cash_cents\":\"null\",\"buffer_cents\":\"null\",\"health\":\"null\",\"predictive\":\"null\",\"history\":\"[]\",\"flows\":\"[]\",\"coverage\":\"[]\",\"drivers\":\"[]\"},\"financial_v3\":{\"points\":\"Point[24]\",\"meta\":\"shared provenance, assumptions, anchors, optional extraction snapshot context\"},\"Point\":{\"month\":\"YYYY-MM-01\",\"as_of\":\"calendar month-end\",\"known_on\":\"null\",\"flow\":\"observed totals/subtotals/composition in EUR, bounds and coverage\",\"service\":\"observed principal/interest service EUR; outstanding null\",\"invoices\":\"AP/AR provisional pending/overdue/aging EUR; mora exposure interval\",\"documents\":\"all-status issued and due-face proxy EUR|null\",\"growth\":\"observed/subtotal -> mom/three_vs_three/yoy: value|null, exact windows, numerator, denominator and coverage\",\"cash\":\"accounts -> native opening/closing cutoff scenarios, range, gap count; verified=false\",\"score\":\"headline=null, full_company_interval=[0,100], observed components, operating scope interval; no midpoint\"},\"array_units\":{\"composition\":\"[known inflow, known outflow]\",\"aging\":[\"1-30\",\"31-60\",\"61-90\",\"91-180\",\"181-360\",\"361+\"],\"cash_scenarios\":[\"anchor opening day\",\"anchor closing day\"],\"intervals\":\"[lower,upper]\"},\"number\":\"finite source binary64; null means unavailable, never NaN\",\"source_keys\":\"meta sources reference receipt input hashes\",\"historical_view\":\"strict=True rejects; retrospective filters points and removes later snapshot context before August\"}","$schema":"https://json-schema.org/draft/2020-12/schema","additionalProperties":false,"properties":{"assessment_date":{"type":"string"},"buffer_cents":{"type":"null"},"coverage":{"items":{},"maxItems":0,"minItems":0,"type":"array"},"currency":{"type":"string"},"data_mode":{"const":"synthetic"},"drivers":{"items":{},"maxItems":0,"minItems":0,"type":"array"},"financial_v3":{"additionalProperties":false,"properties":{"meta":{"type":"object"},"points":{"items":{"additionalProperties":false,"properties":{"as_of":{"type":"string"},"cash":{"additionalProperties":false,"properties":{"accounts":{"items":{"additionalProperties":false,"properties":{"available_balance":{"type":"null"},"closing_range":{"items":{"type":["number","null"]},"maxItems":2,"minItems":2,"type":["array","null"]},"closing_scenarios":{"items":{"type":["number","null"]},"maxItems":2,"minItems":2,"type":["array","null"]},"currency":{"type":"string"},"gap_months":{"type":["number","null"]},"opening_scenarios":{"items":{"type":["number","null"]},"maxItems":2,"minItems":2,"type":["array","null"]},"product_id":{"type":"string"},"reason":{"type":"string"},"verified":{"const":false}},"required":["product_id","currency","opening_scenarios","closing_scenarios","closing_range","gap_months","available_balance","verified","reason"],"type":"object"},"type":"array"}},"required":["accounts"],"type":"object"},"change":{"additionalProperties":false,"properties":{"component_deltas":{"additionalProperties":false,"properties":{"generation":{"type":["number","null"]},"growth":{"type":["number","null"]},"stability":{"type":["number","null"]}},"required":["generation","growth","stability"],"type":"object"},"coverage_changed":{"type":"boolean"},"reason":{"type":"string"},"receipt_reference_changed":{"type":"boolean"}},"required":["component_deltas","receipt_reference_changed","coverage_changed","reason"],"type":"object"},"documents":{"additionalProperties":false,"properties":{"ap_due_face":{"type":["number","null"]},"ap_due_known":{"type":["number","null"]},"ap_issued_known":{"type":["number","null"]},"ar_issued_known":{"type":["number","null"]},"due_missing_eur_rows":{"type":["number","null"]},"issued_rows":{"type":["number","null"]},"unknown_due_rows":{"type":["number","null"]}},"required":["ap_due_face","ap_due_known","ap_issued_known","ar_issued_known","unknown_due_rows","due_missing_eur_rows","issued_rows"],"type":"object"},"flow":{"additionalProperties":false,"properties":{"bounds_without_outliers":{"items":{"type":["number","null"]},"maxItems":2,"minItems":2,"type":"array"},"composition":{"additionalProperties":false,"properties":{"adjustment":{"items":{"type":["number","null"]},"maxItems":2,"minItems":2,"type":"array"},"financing":{"items":{"type":["number","null"]},"maxItems":2,"minItems":2,"type":"array"},"investment":{"items":{"type":["number","null"]},"maxItems":2,"minItems":2,"type":"array"},"operating":{"items":{"type":["number","null"]},"maxItems":2,"minItems":2,"type":"array"},"transfer":{"items":{"type":["number","null"]},"maxItems":2,"minItems":2,"type":"array"},"unknown":{"items":{"type":["number","null"]},"maxItems":2,"minItems":2,"type":"array"}},"required":["operating","financing","investment","transfer","adjustment","unknown"],"type":"object"},"coverage":{"additionalProperties":false,"properties":{"active_accounts":{"type":["number","null"]},"ambiguous_rows":{"type":["number","null"]},"classification":{"type":["number","null"]},"eur":{"type":["number","null"]},"missing_eur_rows":{"type":["number","null"]}},"required":["eur","classification","missing_eur_rows","ambiguous_rows","active_accounts"],"type":"object"},"known_in_out":{"items":{"type":["number","null"]},"maxItems":2,"minItems":2,"type":"array"},"net_known":{"type":["number","null"]},"net_observed":{"type":["number","null"]},"observed":{"type":"boolean"},"operating_bounds":{"items":{"type":["number","null"]},"maxItems":2,"minItems":2,"type":"array"},"operating_payments":{"type":["number","null"]},"operating_receipts":{"type":["number","null"]},"reason":{"type":["string","null"]},"rows":{"type":["number","null"]}},"required":["rows","net_known","net_observed","operating_receipts","operating_payments","observed","known_in_out","composition","operating_bounds","bounds_without_outliers","coverage","reason"],"type":"object"},"growth":{"additionalProperties":false,"properties":{"known_subtotal":{"additionalProperties":false,"properties":{"mom":{"additionalProperties":false,"properties":{"active_perimeter_changed":{"type":["boolean","null"]},"current":{"items":{"type":"string"},"type":"array"},"denominator":{"type":["number","null"]},"min_classification_coverage":{"type":["number","null"]},"min_eur_coverage":{"type":["number","null"]},"numerator":{"type":["number","null"]},"prior":{"items":{"type":"string"},"type":"array"},"reason":{"type":["string","null"]},"value":{"type":["number","null"]}},"required":["value","current","prior","numerator","denominator","reason","min_eur_coverage","min_classification_coverage","active_perimeter_changed"],"type":"object"},"three_vs_three":{"additionalProperties":false,"properties":{"active_perimeter_changed":{"type":["boolean","null"]},"current":{"items":{"type":"string"},"type":"array"},"denominator":{"type":["number","null"]},"min_classification_coverage":{"type":["number","null"]},"min_eur_coverage":{"type":["number","null"]},"numerator":{"type":["number","null"]},"prior":{"items":{"type":"string"},"type":"array"},"reason":{"type":["string","null"]},"value":{"type":["number","null"]}},"required":["value","current","prior","numerator","denominator","reason","min_eur_coverage","min_classification_coverage","active_perimeter_changed"],"type":"object"},"yoy":{"additionalProperties":false,"properties":{"active_perimeter_changed":{"type":["boolean","null"]},"current":{"items":{"type":"string"},"type":"array"},"denominator":{"type":["number","null"]},"min_classification_coverage":{"type":["number","null"]},"min_eur_coverage":{"type":["number","null"]},"numerator":{"type":["number","null"]},"prior":{"items":{"type":"string"},"type":"array"},"reason":{"type":["string","null"]},"value":{"type":["number","null"]}},"required":["value","current","prior","numerator","denominator","reason","min_eur_coverage","min_classification_coverage","active_perimeter_changed"],"type":"object"}},"required":["mom","three_vs_three","yoy"],"type":"object"},"observed":{"additionalProperties":false,"properties":{"mom":{"additionalProperties":false,"properties":{"active_perimeter_changed":{"type":["boolean","null"]},"current":{"items":{"type":"string"},"type":"array"},"denominator":{"type":["number","null"]},"min_classification_coverage":{"type":["number","null"]},"min_eur_coverage":{"type":["number","null"]},"numerator":{"type":["number","null"]},"prior":{"items":{"type":"string"},"type":"array"},"reason":{"type":["string","null"]},"value":{"type":["number","null"]}},"required":["value","current","prior","numerator","denominator","reason","min_eur_coverage","min_classification_coverage","active_perimeter_changed"],"type":"object"},"three_vs_three":{"additionalProperties":false,"properties":{"active_perimeter_changed":{"type":["boolean","null"]},"current":{"items":{"type":"string"},"type":"array"},"denominator":{"type":["number","null"]},"min_classification_coverage":{"type":["number","null"]},"min_eur_coverage":{"type":["number","null"]},"numerator":{"type":["number","null"]},"prior":{"items":{"type":"string"},"type":"array"},"reason":{"type":["string","null"]},"value":{"type":["number","null"]}},"required":["value","current","prior","numerator","denominator","reason","min_eur_coverage","min_classification_coverage","active_perimeter_changed"],"type":"object"},"yoy":{"additionalProperties":false,"properties":{"active_perimeter_changed":{"type":["boolean","null"]},"current":{"items":{"type":"string"},"type":"array"},"denominator":{"type":["number","null"]},"min_classification_coverage":{"type":["number","null"]},"min_eur_coverage":{"type":["number","null"]},"numerator":{"type":["number","null"]},"prior":{"items":{"type":"string"},"type":"array"},"reason":{"type":["string","null"]},"value":{"type":["number","null"]}},"required":["value","current","prior","numerator","denominator","reason","min_eur_coverage","min_classification_coverage","active_perimeter_changed"],"type":"object"}},"required":["mom","three_vs_three","yoy"],"type":"object"}},"required":["observed","known_subtotal"],"type":"object"},"invoices":{"additionalProperties":false,"properties":{"ap":{"additionalProperties":false,"properties":{"aging":{"items":{"type":["number","null"]},"maxItems":6,"minItems":6,"type":"array"},"eur_coverage":{"type":["number","null"]},"overdue":{"type":["number","null"]},"pending":{"type":["number","null"]},"pending_known":{"type":["number","null"]},"uncertain_state_rows":{"type":["number","null"]},"unknown_due_rows":{"type":["number","null"]}},"required":["pending","pending_known","overdue","eur_coverage","uncertain_state_rows","unknown_due_rows","aging"],"type":"object"},"ar":{"additionalProperties":false,"properties":{"aging":{"items":{"type":["number","null"]},"maxItems":6,"minItems":6,"type":"array"},"eur_coverage":{"type":["number","null"]},"overdue":{"type":["number","null"]},"pending":{"type":["number","null"]},"pending_known":{"type":["number","null"]},"uncertain_state_rows":{"type":["number","null"]},"unknown_due_rows":{"type":["number","null"]}},"required":["pending","pending_known","overdue","eur_coverage","uncertain_state_rows","unknown_due_rows","aging"],"type":"object"},"mora_exposure_range":{"items":{"type":["number","null"]},"maxItems":2,"minItems":2,"type":["array","null"]},"reason":{"type":"string"}},"required":["ap","ar","mora_exposure_range","reason"],"type":"object"},"known_on":{"type":"null"},"month":{"type":"string"},"score":{"additionalProperties":false,"properties":{"components":{"additionalProperties":false,"properties":{"generation":{"type":["number","null"]},"growth":{"type":["number","null"]},"stability":{"type":["number","null"]}},"required":["generation","growth","stability"],"type":"object"},"full_company_interval":{"const":[0,100]},"headline":{"type":"null"},"missing_components":{"items":{"type":"string"},"type":"array"},"mora_penalty_range":{"items":{"type":["number","null"]},"maxItems":2,"minItems":2,"type":"array"},"operating_scope_interval":{"items":{"type":["number","null"]},"maxItems":2,"minItems":2,"type":"array"},"operating_scope_score":{"type":"null"},"receipt_reference":{"type":["number","null"]}},"required":["headline","full_company_interval","components","receipt_reference","mora_penalty_range","operating_scope_score","operating_scope_interval","missing_components"],"type":"object"},"service":{"additionalProperties":false,"properties":{"interest_paid_known":{"type":["number","null"]},"missing_eur_rows":{"type":["number","null"]},"outstanding":{"type":["number","null"]},"possible_unidentified_rows":{"type":["number","null"]},"principal_paid_known":{"type":["number","null"]},"rows":{"type":["number","null"]},"service_paid_known":{"type":["number","null"]},"service_paid_observed":{"type":["number","null"]},"unseparated_financing":{"type":["number","null"]}},"required":["principal_paid_known","interest_paid_known","service_paid_known","service_paid_observed","unseparated_financing","rows","missing_eur_rows","possible_unidentified_rows","outstanding"],"type":"object"}},"required":["month","as_of","known_on","flow","service","invoices","documents","growth","cash","score","change"],"type":"object"},"maxItems":24,"minItems":24,"type":"array"}},"required":["points","meta"],"type":"object"},"flows":{"items":{},"maxItems":0,"minItems":0,"type":"array"},"group":{"type":"string"},"health":{"type":"null"},"history":{"items":{},"maxItems":0,"minItems":0,"type":"array"},"history_mode":{"const":"retrospective"},"id":{"type":"string"},"kind":{"const":"financial_health_v3"},"model_version":{"const":"financial-v3-dataset-v1"},"name":{"type":"string"},"opening_cash_cents":{"type":"null"},"predictive":{"type":"null"}},"required":["id","name","group","currency","assessment_date","kind","model_version","history_mode","data_mode","opening_cash_cents","buffer_cents","health","predictive","history","flows","coverage","drivers","financial_v3"],"title":"financial-v3-dataset-v1","type":"object"}
