{"assessment_date":"2026-08-31","buffer_cents":null,"coverage":[],"currency":"EUR","data_mode":"synthetic","drivers":[],"financial_v3":{"meta":{"anchors":[{"anchor_company":"COMP_1094","anchor_currency":"EUR","anchor_date":"2026-09-01","anchor_source_row":6962,"bad_rows":0,"balance":0.0,"before_anchor":-821.0899999999674,"company_id":"COMP_1094","currency":"EUR","product_id":"PRODUCT_02023","through_anchor":-821.0899999999674},{"anchor_company":"COMP_1094","anchor_currency":"EUR","anchor_date":"2026-09-01","anchor_source_row":6963,"bad_rows":0,"balance":82646.45,"before_anchor":31120.770000001183,"company_id":"COMP_1094","currency":"EUR","product_id":"PRODUCT_03170","through_anchor":31120.770000001183}],"availability_assumption":"dataset-v1-booked-issued-month-end-retrospective","known_on":null,"limits":["Observed source totals are not whole-company totals.","AP/AR roles and final-state stocks are retrospective proxies; not verified allocations.","Due-face includes terminal cancellations: documented issuance, not enforceable complete costs.","Cash has two cutoff scenarios, unknown completeness/restrictions, no stock FX and no independent reconciliation.","Receipt growth is not sales; classification, currency and account perimeter may change.","No model, labels, predictive validation or six-question success claim."],"policy_sha256":"1499b9bbf54621da44eff1262bdd1579466df5ebcbc564a8c43669f528197f5f","product_only_group":false,"provenance_grain":"company_id/month in marts; product_id/anchor_source_row for balances; issued/due invoice aggregate query in queries.json","receipt_sha256":"aabc196abd84e70aa78bb56270866e1e3ba25f023ebe468b4425ebe9fd48e871","retrieved_at":"2026-09-19T12:48:14Z","reversal_available_at":"2026-09-19T12:48:14Z","score_policy":{"components":"Pure dimension_points reused for generation/growth/stability only. S=mean six observed receipts; F=receipts minus due AP face proxy. No cash-payment cost reduction.","essential_missing":["unrestricted_reconciled_cash","financial_debt_history","complete_obligations","verified_role_and_availability"],"full_headline":null,"interval_scope":"Operating document/receipt scope only, NOT global health or a confidence interval. True company full interval remains [0,100] because unobserved perimeter is unbounded.","learned":false,"mora_penalty":"40*E/(S+E); unknown E implies [0,40]. Missing dimensions imply [0,100], fixed weights, no renormalization. Publish interval only, never midpoint.","nonpayment":"With fixed receipts and issued due obligations, reduced bank payment cannot increase any component. Provisional mora can only lower the scoped score; missing mora gives uncertainty, not zero.","operating_weights":{"generation":0.4,"growth":0.3,"stability":0.3},"validated":false,"version":"financial-v3-dataset-v1-observed-scorecard-1"},"snapshot_context":{"available_at":"2026-09-19T12:48:14Z","debt_products":[],"extracted_at":"2026-09-19T12:48:14Z","historical_feature_eligible":false,"measured_at":null,"reason":"debt_products lacks measured date; extraction context only, signed raw outstanding, not historical or verified debt","retrospective":true},"source_keys":["panel_flujos","panel_deuda","panel_cobro","invoices","transactions","balances","banking_products","debt_products","companies"],"strict_historical_eligible":false,"version":"financial-v3-dataset-v1"},"points":[{"as_of":"2024-09-30","cash":{"accounts":[{"available_balance":null,"closing_range":[641.4299999999674,641.4299999999674],"closing_scenarios":[641.4299999999674,641.4299999999674],"currency":"EUR","gap_months":13,"opening_scenarios":[821.0899999999674,821.0899999999674],"product_id":"PRODUCT_02023","reason":"single_anchor_unknown_cut_observed_ledger_only","verified":false},{"available_balance":null,"closing_range":[55134.979999998905,55134.979999998905],"closing_scenarios":[55134.979999998905,55134.979999998905],"currency":"EUR","gap_months":0,"opening_scenarios":[51525.679999998814,51525.679999998814],"product_id":"PRODUCT_03170","reason":"single_anchor_unknown_cut_observed_ledger_only","verified":false}]},"change":{"component_deltas":{"generation":null,"growth":null,"stability":null},"coverage_changed":false,"reason":"first_month","receipt_reference_changed":false},"documents":{"ap_due_face":null,"ap_due_known":null,"ap_issued_known":null,"ar_issued_known":null,"due_missing_eur_rows":null,"issued_rows":0,"unknown_due_rows":null},"flow":{"bounds_without_outliers":[3429.6400000001304,527379.9900000001],"composition":{"adjustment":[0.0,0.0],"financing":[0.0,0.0],"investment":[0.0,0.0],"operating":[546738.6400000001,19358.650000000005],"transfer":[0.0,0.0],"unknown":[0.0,523950.35]},"coverage":{"active_accounts":2,"ambiguous_rows":1,"classification":0.95,"eur":1.0,"missing_eur_rows":0},"known_in_out":[546738.6400000001,543309.0],"net_known":3429.640000000014,"net_observed":3429.640000000014,"observed":true,"operating_bounds":[3429.6400000001304,527379.9900000001],"operating_payments":null,"operating_receipts":546738.6400000001,"reason":null,"rows":20},"growth":{"known_subtotal":{"mom":{"active_perimeter_changed":null,"current":["2024-09-01"],"denominator":null,"min_classification_coverage":null,"min_eur_coverage":null,"numerator":null,"prior":["2024-08-01"],"reason":"insufficient_observed_history","value":null},"three_vs_three":{"active_perimeter_changed":null,"current":["2024-07-01","2024-08-01","2024-09-01"],"denominator":null,"min_classification_coverage":null,"min_eur_coverage":null,"numerator":null,"prior":["2024-04-01","2024-05-01","2024-06-01"],"reason":"insufficient_observed_history","value":null},"yoy":{"active_perimeter_changed":null,"current":["2024-09-01"],"denominator":null,"min_classification_coverage":null,"min_eur_coverage":null,"numerator":null,"prior":["2023-09-01"],"reason":"insufficient_observed_history","value":null}},"observed":{"mom":{"active_perimeter_changed":null,"current":["2024-09-01"],"denominator":null,"min_classification_coverage":null,"min_eur_coverage":null,"numerator":null,"prior":["2024-08-01"],"reason":"insufficient_observed_history","value":null},"three_vs_three":{"active_perimeter_changed":null,"current":["2024-07-01","2024-08-01","2024-09-01"],"denominator":null,"min_classification_coverage":null,"min_eur_coverage":null,"numerator":null,"prior":["2024-04-01","2024-05-01","2024-06-01"],"reason":"insufficient_observed_history","value":null},"yoy":{"active_perimeter_changed":null,"current":["2024-09-01"],"denominator":null,"min_classification_coverage":null,"min_eur_coverage":null,"numerator":null,"prior":["2023-09-01"],"reason":"insufficient_observed_history","value":null}}},"invoices":{"ap":{"aging":[null,null,null,null,null,null],"eur_coverage":null,"overdue":null,"pending":null,"pending_known":null,"uncertain_state_rows":null,"unknown_due_rows":null},"ar":{"aging":[null,null,null,null,null,null],"eur_coverage":null,"overdue":null,"pending":null,"pending_known":null,"uncertain_state_rows":null,"unknown_due_rows":null},"mora_exposure_range":null,"reason":"no_invoice_observation_yet"},"known_on":null,"month":"2024-09-01","score":{"components":{"generation":null,"growth":null,"stability":null},"full_company_interval":[0,100],"headline":null,"missing_components":["generation","growth","stability"],"mora_penalty_range":[0.0,40.0],"operating_scope_interval":[0.0,100.0],"operating_scope_score":null,"receipt_reference":null},"service":{"interest_paid_known":0.0,"missing_eur_rows":0,"outstanding":null,"possible_unidentified_rows":1,"principal_paid_known":0.0,"rows":0,"service_paid_known":0.0,"service_paid_observed":null,"unseparated_financing":0.0}},{"as_of":"2024-10-31","cash":{"accounts":[{"available_balance":null,"closing_range":[641.4299999999674,641.4299999999674],"closing_scenarios":[641.4299999999674,641.4299999999674],"currency":"EUR","gap_months":13,"opening_scenarios":[641.4299999999674,641.4299999999674],"product_id":"PRODUCT_02023","reason":"single_anchor_unknown_cut_observed_ledger_only","verified":false},{"available_balance":null,"closing_range":[23311.569999998937,23311.569999998937],"closing_scenarios":[23311.569999998937,23311.569999998937],"currency":"EUR","gap_months":0,"opening_scenarios":[55134.979999998905,55134.979999998905],"product_id":"PRODUCT_03170","reason":"single_anchor_unknown_cut_observed_ledger_only","verified":false}]},"change":{"component_deltas":{"generation":null,"growth":null,"stability":null},"coverage_changed":true,"reason":"missing_components_or_changed_reference_not_causal","receipt_reference_changed":false},"documents":{"ap_due_face":null,"ap_due_known":null,"ap_issued_known":null,"ar_issued_known":null,"due_missing_eur_rows":null,"issued_rows":0,"unknown_due_rows":null},"flow":{"bounds_without_outliers":[-31823.409999999974,327517.86000000004],"composition":{"adjustment":[0.0,0.0],"financing":[0.0,0.0],"investment":[0.0,0.0],"operating":[386843.42000000004,59325.56000000001],"transfer":[0.0,0.0],"unknown":[0.0,359341.27]},"coverage":{"active_accounts":1,"ambiguous_rows":1,"classification":0.9444444444444444,"eur":1.0,"missing_eur_rows":0},"known_in_out":[386843.42,418666.83],"net_known":-31823.410000000033,"net_observed":-31823.410000000033,"observed":true,"operating_bounds":[-31823.409999999974,327517.86000000004],"operating_payments":null,"operating_receipts":386843.42000000004,"reason":null,"rows":18},"growth":{"known_subtotal":{"mom":{"active_perimeter_changed":true,"current":["2024-10-01"],"denominator":546738.6400000001,"min_classification_coverage":0.9444444444444444,"min_eur_coverage":1.0,"numerator":-159895.2200000001,"prior":["2024-09-01"],"reason":null,"value":-0.29245275219618655},"three_vs_three":{"active_perimeter_changed":null,"current":["2024-08-01","2024-09-01","2024-10-01"],"denominator":null,"min_classification_coverage":null,"min_eur_coverage":null,"numerator":null,"prior":["2024-05-01","2024-06-01","2024-07-01"],"reason":"insufficient_observed_history","value":null},"yoy":{"active_perimeter_changed":null,"current